ID;FR;EN;ZH
CombatE1B1RE2;Ton ignorance n'est que malice, tu ne sais rien des combats que nous avons mené ! Nous nous sommes battus sans relâche pour faire de cet endroit ce qu'il est aujourd'hui, à la gloire du Seigneur ! Je ne te laisserais pas passer !;You are ignorant. You are foolish. Our Lord have mercy on your soul. I will not let you pass little lamb. We have worked far too hard to make this place the way it is now. ;你太无知了 你太愚蠢了 愿主怜悯你的灵魂 我不会让你通过的 小羔羊 我们付出了太多的努力 才让这里变成现在这个样子
CombatE1B1RJ5;Mais bon sang, pourquoi ?! Passer ou rester ne concerne que moi ! Je ne vous laisserais pas m'empecher d'accéder à ma nouvelle vie !;If you do not let me continue my journey then I will have to treat you as an obstacle and hurdle. If you're in my way, you will be destroyed.;如果你不让我继续我的旅程 那我就只能把你当成障碍和绊脚石了 如果你挡了我的路，你就会被毁灭。
CombatE1B1RJ6;Attendez, n'est-ce pas ici le domaine des dieux, infini, immuable et éternel ? Avez vous osé l'altérer ? Pourquoi ?!;You worked hard to make God's paradise the way it is now? Was your Lord too weak and stupid to do it himself?;你辛辛苦苦把上帝的乐园变成了现在这个样子？难道你的主太软弱、太愚蠢，不能亲自动手吗？
CombatE1B1F3;Si tu venais à descendre, tu disparaitrais et ton âme enfournée les renforcerait encore plus, que tu le veuilles ou non ! Ignorance ou Inconscience ne sont point vertu, je garderais cette voie ! Seigneur guidez ma lame, et qu'il disparaisse de ma vue !;I tried to reason with you but you are beyond help. Your blasphemies have rendered you beyond saving. You are worth nothing as you are, maybe your sacrifice will redeem you in some way. Lord, guide my blade as I send you another offering.;我试着跟你讲道理，但你已经无能为力了。你的亵渎已经让你无可救药。你现在一文不值 也许你的牺牲能让你得到救赎 主啊，请指引我的刀锋，让我为你献上另一份祭品。
CombatE1B1F4;Ignorant ! Cet endroit était un champ de ruine avant ! Nous nous sommes battus pour ce sol sacré et avons restauré la présence de Dieu en ces lieux ! A présent, Seigneur guidez ma lame, aidez moi à protéger ce qui est votre !;You know not what you have said or who you have insulted. You are worth nothing as you are. O Lord, guide my blade as I send you another offering.;你不知道自己说了什么，也不知道自己侮辱了谁。你一文不值。主啊，请指引我的刀锋，我将为你献上另一份祭品。
